{
    "title": "Kill a microservice",
    "description": "Killing a microservice will trigger service failure",
    "backend": {
        "name": "kubernetes"
    },
    "method": [
        {
            "title": "Checking our system is healthy",
            "probes": {
                "steady": {
                    "name": "microservices-all-healthy"
                }
            }
        },
        {
            "title": "Killing a service abruptly",
            "action": {
                "name": "kill-microservice",
                "parameters": {
                    "name": "cherrypy-webapp"
                },
                "pauses": {
                    "after": 5
                }
            },
            "probes": {
                "steady": {
                    "name": "microservice-available-and-healthy",
                    "parameters": {
                        "name": "cherrypy-webapp"
                    }
                },
                "close": {
                    "name": "microservice-is-not-available",
                    "parameters": {
                        "name": "cherrypy-webapp"
                    }
                }
            }
        },
        {
            "title": "Start a microservice",
            "action": {
                "name": "start-microservice",
                "parameters": {
                    "config-path": "/home/sylvain/dev/oss/weavcfg/cherrypy-webapp.json"
                },
                "pauses": {
                    "after": 5
                }
            },
            "probes": {
                "steady": {
                    "name": "microservice-is-not-available",
                    "parameters": {
                        "name": "cherrypy-webapp"
                    }
                },
                "close": {
                    "name": "microservice-available-and-healthy",
                    "parameters": {
                        "name": "cherrypy-webapp"
                    }
                }
            }
        },
        {
            "title": "Checking our system is healthy once microservice has been restarted",
            "probes": {
                "steady": {
                    "name": "microservices-all-healthy"
                }
            }
        }
    ]
}